{
  "ome_csv_version": "0.1",
  "source": {
    "system": "OME",
    "description": "Synthetic harness fixture; not measured telemetry"
  },
  "sample_rate_hz": 10.0,
  "channels": {
    "speed_src": {
      "source_name": "Synthetic Vehicle Speed",
      "unit": "m/s",
      "data_type": "float"
    },
    "throttle_src": {
      "source_name": "Synthetic Throttle Position",
      "unit": "%",
      "data_type": "float"
    },
    "brake_src": {
      "source_name": "Synthetic Brake Input",
      "unit": "%",
      "data_type": "float"
    },
    "steering_src": {
      "source_name": "Synthetic Steering Angle",
      "unit": "rad",
      "data_type": "float"
    },
    "rpm_src": {
      "source_name": "Synthetic Engine Speed",
      "unit": "rpm",
      "data_type": "float"
    },
    "gear_src": {
      "source_name": "Synthetic Gear",
      "unit": "",
      "data_type": "integer"
    },
    "lap_src": {
      "source_name": "Synthetic Lap",
      "unit": "",
      "data_type": "integer"
    }
  },
  "context": {
    "session": "Harness fixture",
    "lap": 1
  }
}
